abc3,Spain,https://www.urbanadventures.com/spain,/spain,Country,,Europe,"A passionate tapestry of regional cultures, architectural masterpieces, and culinary excellence, Spain pulses with an infectious energy that captivates every visitor. From the artistic boulevards of Madrid to the Gothic wonders of Barcelona, each city tells its own story through flamenco rhythms, innovative cuisine, and locals who know how to truly live life. Whether you're discovering hidden tapas bars, marveling at GaudÌ's architectural dreams, or joining in the vibrant street life that continues well past midnight, Spain offers an intoxicating blend of tradition and modernity that will leave you planning your return before you've even left.",,,,,,,
abc4,Romania,https://www.urbanadventures.com/romania,/romania,Country,,Europe,"Eastern Europe's best-kept secret, Romania surprises visitors with its sophisticated blend of French elegance and Balkan passion in cities like ""Little Paris"" Bucharest. This captivating country offers a delightful chaos of culture, incredible cuisine, and some of the continent's most welcoming and colorful locals ready to share their stories. From exploring medieval castles to discovering vibrant neighborhoods where East meets West, Romania provides an authentic European experience away from the crowds, filled with genuine warmth and unexpected discoveries at every turn.",,,,,,,
abc5,Croatia,https://www.urbanadventures.com/croatia,/croatia,Country,,Europe,"A stunning Mediterranean gem where ancient Roman palaces meet crystal-clear Adriatic waters, Croatia offers visitors paradise both on its historic cobblestones and pristine islands. From the breathtaking city walls of Dubrovnik to the atmospheric streets of Split that grew within UNESCO World Heritage sites, this coastal paradise combines rich history with exceptional cuisine influenced by Italian traditions and fresh Adriatic seafood. Whether you're island-hopping to discover hidden coves, exploring Game of Thrones filming locations, or simply enjoying people-watching along the vibrant Riva Promenade, Croatia delivers an unforgettable blend of culture, natural beauty, and warm hospitality.",,,,,,,
abc6,Italy,https://www.urbanadventures.com/italy,/italy,Country,,Europe,"The birthplace of the Renaissance continues to enchant travelers with its perfect marriage of artistic masterpieces, culinary excellence, and passionate local culture. From the rolling vineyards of Tuscany to the romantic canals of Venice, Italy offers an sensory feast where every meal is an celebration and every corner reveals centuries of history and artistry. Whether you're learning authentic cooking secrets from local nonnas in Florence or navigating the 150 canals of Venice with insider knowledge, this beloved destination promises to loosen your belt loops and fill your heart with ""la dolce vita"" memories that last a lifetime.",,,,,,,
abc7,United Kingdom,https://www.urbanadventures.com/united kingdom,/united-kingdom,Country,,Europe,"A fascinating blend of royal traditions and cutting-edge innovation, the UK offers travelers an incredible journey through diverse cultures, buzzing nightlife, and world-class attractions that have shaped global culture. From London's eclectic neighborhoods where ""if you're bored of London, you're bored with life"" rings eternally true, to charming countryside villages steeped in centuries of history, Britain provides endless discoveries for curious travelers. With its renowned museums, traditional pubs, and wonderfully diverse communities, the United Kingdom serves as a perfect introduction to European culture while maintaining its own distinctive character that has influenced the world for generations.",,,,,,,
abc8,France,https://www.urbanadventures.com/france,/france,Country,,Europe,"From the romantic back streets to the legendary bakeries, France delights the senses around every corner with its unmatched blend of culinary mastery, artistic heritage, and effortless sophistication. The world's most visited country offers travelers everything from charming provincial markets to iconic Parisian boulevards, where each experience tells a story of French passion for the finer things in life. Whether you're discovering hidden wine caves with local vintners or exploring centuries-old architectural marvels, France provides those lifelong memories that are different from any other destination on Earth, leaving visitors with an deep appreciation for the art of living well.",,,,,,,
abc9,Austria,https://www.urbanadventures.com/austria,/austria,Country,,Europe,"Where imperial grandeur meets cutting-edge contemporary style, Austria represents a romantically beautiful marriage of architectural magnificence and cultural sophistication along the banks of the blue Danube. From world-class opera and classical music venues to an opulent coffeehouse culture that defines civilized leisure, this imperial gem buzzes with a food scene and glorious parks that make every day feel like a celebration. As Karl Kraus noted, Vienna's streets are ""paved with culture,"" and after experiencing the incredible sights, tastes, and musical traditions, you'll find yourself singing the city's praises long after you leave.",,,,,,,
abc10,Indonesia,https://www.urbanadventures.com/indonesia,/indonesia,Country,,Asia,"Beautiful Indonesia, with its cliffside temples, colorful festivals, and gorgeous beaches, creates one of Earth's most romantic and spiritually enriching destinations. From the wild waves of Kuta to the rich arts scene of Ubud, this diverse archipelago attracts surf fanatics, adventure hunters, honeymooning couples, culture enthusiasts, spiritual seekers, and party-loving backpackers who all discover their own version of paradise. Whether you're hiking volcanic trails, visiting unique Balinese Hindu temples that celebrate a religion found nowhere else in the world, or simply embracing the kind and caring culture, Indonesia offers transformative experiences that define what paradise truly means.",,,,,,,
abc11,Thailand,https://www.urbanadventures.com/thailand,/thailand,Country,,Asia,"The ""Land of Smiles"" welcomes travelers with a sensory adventure that perfectly balances chaotic urban energy with serene cultural traditions and stunning natural beauty. From navigating Bangkok's bustling markets and hidden canals by longtail boat to discovering ancient temples and sampling incredible street food that tantalizes every taste bud, Thailand offers an intensity of experience that both treats and overwhelms the senses. Whether you're exploring busy back streets by bike or finding zen in golden Buddhist temples, this dynamic kingdom provides the perfect introduction to Southeast Asian culture, cuisine, and hospitality that will leave you planning your next visit before you've even departed.",,,,,,,
abc12,India,https://www.urbanadventures.com/india,/india,Country,,Asia,"To experience India is to embark on a journey that simultaneously treats and challenges every sense, creating memories that will transform your perspective on life itself. From the chaotic, explosive energy of Delhi's streets filled with vendors calling and traffic weaving in mesmerizing patterns, to discovering the incredible flavors that define one of the world's great cuisines, India offers an intensity that requires a local guide to truly appreciate. This incredible subcontinent rewards adventurous travelers with a rich tapestry of cultures, spiritual traditions, and warm hospitality that, once experienced with local insight, reveals why India captures hearts and minds like no other destination on Earth.",,,,,,,
abc13,Vietnam,https://www.urbanadventures.com/vietnam,/vietnam,Country,,Asia,"From the intense, enchanting chaos of Hanoi's honking streets to the dreamy, UNESCO-listed charm of Hoi An's lantern-lit evenings, Vietnam offers travelers a sensory journey through a country where rich history beautifully melds with complicated modernity. This captivating destination combines French colonial architecture with bustling local markets, ancient temples with Communist landmarks, and heartbreaking historical sites with some of Asia's most delectable street food and cooking classes. Whether you're navigating Ho Chi Minh City's gourmet restaurants and luxury shopping or biking past emerald rice paddies in the countryside, Vietnam provides that perfect taste of everything this resilient and welcoming nation has to offer adventurous travelers.",,,,,,,
abc14,Turkey,https://www.urbanadventures.com/turkey,/turkey,Country,,Asia,"Straddling two continents with 2,500 years of history, Turkey dazzles visitors with its ability to reinvent itself while maintaining an timeless capacity to enchant all who visit this bi-continental wonder. From the exotic aromas of the Spice Bazaar to incredible skylines dotted with minarets and the breathtaking beauty of the Bosphorus, Istanbul alone offers enough discoveries to fill multiple visits. Whether you're exploring hidden nooks and crannies in ancient neighborhoods or marveling at the seamless blend of European and Asian cultures, Turkey provides an extraordinary travel experience where every corner reveals another layer of this fascinating crossroads of civilizations.",,,,,,,
abc15,Nepal,https://www.urbanadventures.com/nepal,/nepal,Country,,Asia,"Prepare yourself for the ultimate sensory overload, because Nepal delivers rich culture, hidden temples, colorful bazaars, and the friendliest, warmest welcome you'll encounter anywhere in the Himalayas. From the bustling streets of Kathmandu where every turn reveals new cultural treasures to the stunning mountain vistas that have drawn adventurers for generations, this incredible kingdom offers experiences for both urban explorers and intrepid adrenaline junkies. Whether you're discovering ancient temples tucked away in vibrant neighborhoods or preparing for high-altitude adventures, Nepal provides that perfect blend of spiritual discovery and physical challenge that creates truly transformative travel experiences.",,,,,,,
abc16,Japan,https://www.urbanadventures.com/japan,/japan,Country,,Asia,"The very definition of a modern mega-metropolis, Japan seamlessly blends cutting-edge innovation with deeply rooted traditions, creating a country that continuously surprises and delights visitors with its complexity and charm. From Tokyo's teeming street life and incredible cuisine scene that will captivate any foodie, to the meticulous attention to detail that defines Japanese culture, this monumental nation offers travelers a glimpse into both the future and the past simultaneously. Whether you're navigating the bustling energy of urban life or discovering quiet temples and traditional arts, Japan provides those once-in-a-lifetime cultural experiences that can only be fully appreciated with local insight and knowledge.",,,,,,,
abc17,United States,https://www.urbanadventures.com/united states,/united-states,Country,,North America,"A vast tapestry of diverse neighborhoods, distinguished architecture, and rich cultural traditions, America offers travelers an incredible journey through friendly communities from coast to coast that have successfully carved out their own unique identities. From Boston's revolutionary history and Chicago's welcoming Midwest charm to New York's unparalleled urban energy and Seattle's coffee culture with amazing views, each American city tells its own story through local food, music, and the passionate people who call these places home. Whether you're exploring 400 years of history, discovering craft beer scenes, or experiencing the welcoming spirit that draws millions to happily call this dynamic nation home, the United States provides authentic local experiences that showcase why this land of opportunity continues to captivate visitors from around the world.",,,,,,,
abc18,Cuba,https://www.urbanadventures.com/cuba,/cuba,Country,,North America,"Trapped in time yet vibrantly alive in the present moment, Cuba offers travelers a unique glimpse into a world where vintage cars prowl colonial streets and crumbling art deco architecture tells stories of revolution and resilience. From exploring Afro-Cuban religious traditions to discovering the broken beauty of UNESCO-designated Havana architecture, this Caribbean island provides cultural experiences found nowhere else on Earth. Whether you're learning about la RevoluciÛn from passionate locals or finishing your day with a perfectly crafted mojito in la Habana Vieja, Cuba delivers those authentic travel moments that challenge perceptions while celebrating the enduring spirit of its remarkable people.",,,,,,,
abc19,Mexico,https://www.urbanadventures.com/mexico,/mexico,Country,,North America,"Ancient ruins meet vibrant markets, delicious cuisine mingles with traditional mariachi, and the excitement of Lucha Libre wrestling creates an unforgettable blend that defines Mexico's incredible cultural richness. From exploring the deep roots of Mexican history to kicking back in cantinas with new friends or cheering for masked wrestlers, this dynamic nation offers travelers authentic experiences that showcase why Mexico has captivated visitors for generations. Whether you're wandering through colorful neighborhoods, sampling street food that represents centuries of culinary evolution, or discovering the warm hospitality that makes every visitor feel like family, Mexico provides those magical travel moments that create lifelong memories and deep cultural connections.",,,,,,,
abc20,Costa Rica,https://www.urbanadventures.com/costa rica,/costa-rica,Country,,North America,"With a tagline like ""Pura Vida,"" Costa Rica embodies the pure life philosophy that immediately puts travelers in the perfect mindset for adventure and relaxation in one of the world's most biodiverse destinations. From cycling through rainforest suburbs to sampling some of the world's finest coffee and chocolate exports, this Central American gem offers the ideal blend of natural beauty and cultural authenticity. Whether you're journeying through lush rainforests teeming with wildlife or discovering why Costa Ricans have mastered the art of living well, this welcoming nation provides those transformative travel experiences that perfectly capture what the pure life truly means.",,,,,,,
abc21,Canada,https://www.urbanadventures.com/canada,/canada,Country,,North America,"Cool enough to earn recognition from Vogue magazine and multicultural enough to be ranked among the globe's most diverse communities, Canada offers travelers a sophisticated blend of urban innovation and natural beauty that defines modern North American culture. From Toronto's Queen West neighborhood's international flair to exploring cultural diversity through local hot spots, craft beer, and yes, incredible bacon, this ""city of neighbourhoods"" nation provides every flavor of international experience imaginable. Whether you're discovering what makes Canadian cities some of the world's most livable or exploring the vast wilderness that stretches from coast to coast, Canada delivers those authentic experiences that showcase why this welcoming nation consistently ranks among the world's best places to visit and live.",,,,,,,
abc22,Egypt,https://www.urbanadventures.com/egypt,/egypt,Country,,Africa,"Discover the world's living history book in a land where ancient wonders stand alongside vibrant modern culture, creating an mesmerizing destination that brings millennia of human civilization to life before your eyes. From the infamous pyramids that continue to inspire awe to the bustling streets of Cairo where every corner holds stories spanning thousands of years, Egypt offers travelers the chance to walk through history while experiencing the warm hospitality of contemporary Egyptian culture. Whether you're uncovering fascinating ""did you know"" facts about pharaohs and ancient mysteries or exploring how this incredible civilization continues to thrive today, Egypt provides those once-in-a-lifetime experiences that transform your understanding of human achievement and cultural legacy.",,,,,,,
abc23,Morocco,https://www.urbanadventures.com/morocco,/morocco,Country,,Africa,"A sensory journey where the exotic meets the accessible, Morocco enchants visitors with its blend of ancient medinas, stunning art deco architecture, and the intoxicating rhythm of North African life that feels both foreign and welcoming. From the bustling souks of Marrakech filled with tantalizing aromas and beautiful craftsmanship to the modern sophistication of Casablanca where you can sip mint tea while watching life unfold, this kingdom offers the perfect introduction to African culture just steps from Europe. Whether you're exploring pink city walls that have stood for centuries or discovering how traditional Moroccan hospitality makes every visitor feel like family, Morocco provides those transformative travel experiences that enrich all the senses and create lasting connections to this magical land.",,,,,,,
abc24,Kenya,https://www.urbanadventures.com/kenya,/kenya,Country,,Africa,"Exciting and notably cosmopolitan, Kenya serves as the vibrant social hub of East Africa, offering travelers an ideal way to experience the sights, sounds, and smells of one of the continent's most dynamic regions. From the bustling energy of Nairobi's streets to the incredible wildlife experiences that await in the surrounding landscapes, this fascinating destination provides VIP access into the heart of authentic African culture and natural beauty. Whether you're discovering the real character of urban Kenya through local markets and neighborhoods or preparing for safari adventures that showcase the continent's incredible biodiversity, Kenya offers those genuine African experiences that reveal why this welcoming nation continues to captivate travelers from around the world.",,,,,,,
abc25,Peru,https://www.urbanadventures.com/peru,/peru,Country,,South America,"An unbeatable blend of ancient Inca mysteries and modern culinary excellence, Peru offers travelers a country where mystical archaeological sites coexist with exceptional contemporary culture and world-renowned cuisine that's taking the global food scene by storm. From the hidden secrets and mystical tales of Cusco's cobblestone streets to Lima's incredible dining scene featuring the best Pisco Sours you'll ever taste, this South American gem provides experiences that span millennia while remaining thoroughly contemporary. Whether you're exploring lands of Inca legends with passionate local guides or discovering why Peru has become a must-visit destination for food enthusiasts, this remarkable nation offers those transformative travel experiences that connect you to both ancient wisdom and cutting-edge innovation.",,,,,,,
abc26,Ecuador,https://www.urbanadventures.com/ecuador,/ecuador,Country,,South America,"With incredible mountain views, a delectable food scene that rivals any South American destination, and an Old Town so beautiful it takes your breath away, Ecuador delivers ""it all and more"" in a compact package that maximizes every travel moment. From savoring innovative Andean cuisine to exploring vibrant markets where local culture comes alive, this diverse nation offers the perfect blend of urban sophistication and natural beauty that defines modern South American travel. Whether you're walking historic streets with knowledgeable locals, taking scenic jaunts up into the dramatic Andes mountains, or discovering why Ecuador punches above its weight in terms of cultural and culinary offerings, this remarkable destination provides those unforgettable travel experiences you won't be forgetting in a hurry.",,,,,,,
abc27,Oceania ,https://www.urbanadventures.com/oceania ,/oceania ,Continent,,,"A vast region of pristine natural beauty and unique cultures, Oceania offers travelers the chance to discover some of Earth's most unspoiled destinations where friendly locals welcome visitors to experience island life, wildlife encounters, and landscapes found nowhere else on the planet. From Australia's cosmopolitan cities and iconic natural habitats to the countless islands that dot the Pacific with their own distinct cultures and breathtaking beauty, this region provides the perfect escape for those seeking both adventure and relaxation in stunning settings. Whether you're exploring vibrant coral reefs, encountering endemic wildlife, or simply enjoying the laid-back island lifestyle that defines much of Oceania, this remarkable region offers those once-in-a-lifetime experiences that showcase the incredible diversity and natural wonder of our planet's largest ocean region.",,,,,,,
abc28,Europe,https://www.urbanadventures.com/europe,/europe,Continent,,,"A continent where ancient history seamlessly blends with cutting-edge innovation, Europe offers travelers an incredible journey through diverse cultures, architectural masterpieces, and culinary traditions that have influenced the world for millennia. From the romantic boulevards of Paris to the imperial grandeur of Vienna, the Gothic wonders of Barcelona to the Renaissance treasures of Florence, each destination tells its own story while contributing to the rich tapestry that makes European travel so endlessly rewarding. Whether you're discovering hidden local secrets in bustling capitals, exploring UNESCO World Heritage sites with passionate guides, or simply enjoying the cafÈ culture and sophisticated lifestyle that defines European living, this remarkable continent provides those transformative travel experiences that connect you to the roots of Western civilization while embracing contemporary innovation.",,,,,,,
abc29,Asia,https://www.urbanadventures.com/asia,/asia,Continent,,,"A sensory adventure that spans from ancient temples to mega-metropolises, Asia offers travelers the world's most diverse cultural experiences, incredible cuisine, and spiritual discoveries that challenge and reward every sense. From the intense energy of bustling markets and honking streets to the serene beauty of hidden temples and pristine natural landscapes, this vast continent provides experiences that range from chaotic urban exploration to peaceful spiritual reflection. Whether you're navigating the cutting-edge innovation of Japan's cities, discovering the rich culinary traditions that define multiple Asian cultures, or exploring archaeological wonders and religious sites that have inspired humanity for thousands of years, Asia delivers those life-changing travel experiences that broaden perspectives and create lasting connections to some of the world's most fascinating civilizations.",,,,,,,
abc30,North America,https://www.urbanadventures.com/north america,/north-america,Continent,,,"A diverse tapestry of cultures, landscapes, and experiences, North America offers travelers everything from revolutionary history and urban sophistication to pristine wilderness and vibrant local communities that have successfully maintained their unique identities across vast distances. From the multicultural neighborhoods of major cities to charming small towns, craft breweries to world-class museums, this dynamic continent provides endless opportunities to discover friendly locals who are passionate about sharing their distinctive regional cultures, foods, and traditions. Whether you're exploring centuries of history, experiencing the welcoming spirit that draws millions to call North America home, or discovering natural wonders that span from arctic tundra to tropical beaches, this remarkable continent offers authentic experiences that showcase why it continues to be a land of opportunity and adventure for travelers from around the world.",,,,,,,
abc31,Africa,https://www.urbanadventures.com/africa,/africa,Continent,,,"The cradle of humanity offers travelers an extraordinary journey through diverse cultures, breathtaking landscapes, and wildlife experiences that exist nowhere else on Earth, creating adventures that transform perspectives and create lifelong connections. From the bustling energy of cosmopolitan cities like Cairo and Nairobi to the ancient traditions preserved in colorful markets and communities, Africa provides authentic experiences that reveal the real character and incredible warmth of its people. Whether you're discovering living history in Egypt's archaeological wonders, experiencing the vibrant social hub of East African culture, or exploring the exotic blend of cultures in North African kingdoms, this remarkable continent offers those genuine travel moments that showcase why Africa continues to captivate visitors with its unmatched combination of cultural richness, natural beauty, and unforgettable hospitality.",,,,,,,
abc32,South America,https://www.urbanadventures.com/south america,/south-america,Continent,,,"An incredible blend of ancient civilizations and contemporary innovation, South America offers travelers mystical archaeological sites, world-renowned cuisine, and vibrant cultures that span from the dramatic Andes mountains to bustling coastal cities that pulse with energy and passion. From exploring Inca legends in Peru's mountain cities to discovering why South American cuisine is taking the global food scene by storm, this diverse continent provides experiences that connect travelers to both ancient wisdom and cutting-edge culinary excellence. Whether you're wandering through UNESCO-listed colonial architecture, learning to make authentic dishes with passionate local chefs, or taking scenic journeys through landscapes that range from Amazon rainforests to dramatic mountain peaks, South America delivers those transformative travel experiences that enrich all the senses and create unforgettable connections to this remarkable region's rich cultural heritage and natural beauty.",,,,,,,
