589742AD-FED0-435B-9F2C-EBAA4D93ACC4,Boston,https://www.urbanadventures.com/en/boston,/boston,City,United States,North America,"Bostonians consider their city to be the best in the world, enjoying a mix of life in a modern metropolis with a rich history going back 400 years and a strong passion for tradition. Boston is the birthplace of the American Revolution, and it shows, boasting an incredibly diverse assortment of people living in 23 neighborhoods that have successfully carved out their own unique identity.† Travelers here are sure to get a better understanding of the city through its people, its sights, and its history.",,https://cdn.ventrata.com/image/upload/s--v2UghDNI--/v1744705476/lbzet1biazjkdmbrt5zs.jpg,https://www.tripadvisor.com.au/Attraction_Review-g60745-d23471903-Reviews-Intrepid_Urban_Adventures_Boston-Boston_Massachusetts.html,4.9,"2,423 reviews",https://www.tripadvisor.com.au/Attraction_Review-g60745-d23471903-Reviews-Intrepid_Urban_Adventures_Boston-Boston_Massachusetts.html#REVIEWS,"Intrepid has been taking travellers around the globe since 1989. With locally based leaders out front of every adventure, they have more than 1000 immersive trips in over 100 countries to choose from. More than just good views and great times, these adventures connect you to the places you go, the people you meet along the way and the communities at the heart of every Intrepid experience."
C129084E-E25C-4CA3-BD86-2A78DA320783,Chicago,https://www.urbanadventures.com/en/chicago,/chicago,City,United States,North America,"Chicago is a lively city bursting with distinguished architecture, diverse neighborhoods, and a rich culture of food, history, and music throughout. Filled with friendly folks from all walks of life, Chicago is a welcoming place to explore and youíll see why millions of people happily call this Midwest metropolis home.",,https://cdn.ventrata.com/image/upload/s--ZHEjO50o--/v1746796504/jgfntlowcjy9mkhzvk66.jpg,https://www.tripadvisor.com.au/Attraction_Review-g35805-d23471901-Reviews-Intrepid_Urban_Adventures_Chicago-Chicago_Illinois.html,4.9,602 reviews,https://www.tripadvisor.com.au/Attraction_Review-g35805-d23471901-Reviews-Intrepid_Urban_Adventures_Chicago-Chicago_Illinois.html#REVIEWS,"Intrepid has been taking travellers around the globe since 1989. With locally based leaders out front of every adventure, they have more than 1000 immersive trips in over 100 countries to choose from. More than just good views and great times, these adventures connect you to the places you go, the people you meet along the way and the communities at the heart of every Intrepid experience."
93B2334E-83AA-474D-95F9-BF875BBCEACE,Denver,https://www.urbanadventures.com/en/denver,/denver,City,United States,North America,"Denver is a magnet for outdoorsy people, with a local community filled with great people who really enjoy where they live, and for good reason. That's because Denver has a booming craft beer scene and food scene and art scene and coffee scene and of course, an outdoors scene!",,https://cdn.ventrata.com/image/upload/s--Uo6OsCba--/v1744706070/ftohepblzq62w8jaekhp.jpg,https://www.tripadvisor.com.au/Attraction_Review-g33388-d23471975-Reviews-Intrepid_Urban_Adventures_Denver-Denver_Colorado.html,4.9,403 reviews,https://www.tripadvisor.com.au/Attraction_Review-g33388-d23471975-Reviews-Intrepid_Urban_Adventures_Denver-Denver_Colorado.html#REVIEWS,"Intrepid has been taking travellers around the globe since 1989. With locally based leaders out front of every adventure, they have more than 1000 immersive trips in over 100 countries to choose from. More than just good views and great times, these adventures connect you to the places you go, the people you meet along the way and the communities at the heart of every Intrepid experience."
77C15FC5-30E0-4A96-A218-D88D1C36606B,Havana,https://www.urbanadventures.com/en/havana,/havana,City,Cuba,North America,"Havanaís often described as being trapped in a time warp, thanks to the cool retro cars prowling the streets and the crumbling mix of colonial and art deco design. But while we love the vintage vibe of Havana, the city also has so much more to explore in the here and now. Take a Havana city tour that will expose you to Afro-Cuban religion, show you the broken beauty that defines the cityís spectacular, UNESCO-designated architecture, and teach you about what remains today of la RevoluciÛn. Then finish it all off, of course, with a mojito in la Habana Vieja.",,https://cdn.ventrata.com/image/upload/s--xnfRLs_l--/v1744716741/chnqc0afl8sr2dbogywx.jpg,https://www.tripadvisor.com.au/Attraction_Review-g147271-d4681838-Reviews-Urban_Adventures-Havana_Ciudad_de_la_Habana_Province_Cuba.html,4.9,366 reviews,https://www.tripadvisor.com.au/Attraction_Review-g147271-d4681838-Reviews-Urban_Adventures-Havana_Ciudad_de_la_Habana_Province_Cuba.html#REVIEWS,"Havana Adventures offers day tours with a local expert guide in Havana. In only a few hours, you‚Äôll uncover back streets and hidden gems as you step into the lives of locals, find out what makes the city tick, and get acquainted with local food, culture, and traditions. This fantastic urban experience is sure to be your best. day. ever. in Havana. Tours of Havana with local expert guides. General and specialist tours including Walking tours of Old Havana, Classic Car Tours, Art Deco in Havana, Cuban Food Tour, Afro-Cuban religion, Baseball, Havana by Night, Hemingway's Havana, and more, as well as custom tours & private tours. A product of Big Planet Adventures Pty Ltd."
1EB36D3B-D2C7-4266-987B-991304C9D434,Mexico City,https://www.urbanadventures.com/en/mexico-city,/mexico-city,City,Mexico,North America,"Explore ancient ruins, local markets, delicious cuisine, traditional mariachi, and even Lucha Libre Mexican wrestling! Many visit Mexico to do a number of these things, but with an Urban Adventures Mexico City tour, you'll discover all of this in the best way possible - with a local. Whether youíre into venturing through Mexicoís history, just kicking back in a cantina with new friends, or screaming at grown men in wrestling masks, weíll surely not disappoint.",,https://cdn.ventrata.com/image/upload/s--Ia6Tg4Iy--/v1744716816/lkj4ug4ympkj53n2l3cz.jpg,https://www.tripadvisor.com.au/Attraction_Review-g150800-d23358033-Reviews-Intrepid_Urban_Adventures_Mexico_City-Mexico_City_Central_Mexico_and_Gulf_Coast.html,4.8,468 reviews,https://www.tripadvisor.com.au/Attraction_Review-g150800-d23358033-Reviews-Intrepid_Urban_Adventures_Mexico_City-Mexico_City_Central_Mexico_and_Gulf_Coast.html#REVIEWS,"Intrepid has been taking travellers around the globe since 1989. With locally based leaders out front of every adventure, they have more than 1000 immersive trips in over 100 countries to choose from. More than just good views and great times, these adventures connect you to the places you go, the people you meet along the way and the communities at the heart of every Intrepid experience."
6BE291CD-E12B-4E98-9384-2C5A2ACBCD74,New Orleans,https://www.urbanadventures.com/en/new-orleans,/new-orleans,City,United States,North America,"Built barely above sea level, some say New Orleans should have never been settled in the first place. Still, thereís a reason why its residents would never dream of living anywhere else! Three hundred years after French colonization, this multicultural melting pot is still going strong and is more flavorful than ever. From colorful cottages, impromptu parades and mouth-watering meals, every street corner in ìThe Big Easyî is guaranteed to offer a unique surprise.",https://www.youtube.com/watch?v=Mr7O8J9e2Ao,https://cdn.ventrata.com/image/upload/s--ODCnHFtf--/v1744716932/xu8bhd15j4tbj9nnwxez.jpg,https://www.tripadvisor.com.au/Attraction_Review-g60864-d23471927-Reviews-Intrepid_Urban_Adventures_New_Orleans-New_Orleans_Louisiana.html,4.9,"1,235 reviews",https://www.tripadvisor.com.au/Attraction_Review-g60864-d23471927-Reviews-Intrepid_Urban_Adventures_New_Orleans-New_Orleans_Louisiana.html#REVIEWS,"Intrepid has been taking travellers around the globe since 1989. With locally based leaders out front of every adventure, they have more than 1000 immersive trips in over 100 countries to choose from. More than just good views and great times, these adventures connect you to the places you go, the people you meet along the way and the communities at the heart of every Intrepid experience."
A192FDD7-754C-4EC5-ACD6-2B81421A369D,New York,https://www.urbanadventures.com/en/new-york,/new-york,City,United States,North America,"With nearly 8.5 million residents, NYC is anything but personal. Find the local connection on an Urban Adventures NYC tour, to eat, drink, and be merry around the city that never sleeps. So many people travel to New York and whizz round the city catching the big sights ñ with our tours you get to see life as it is for the true locals of this incredible metropolis.",https://www.youtube.com/watch?v=XvsjT35Ie8M,https://cdn.ventrata.com/image/upload/s--QOJClmQd--/v1744717794/w95g0jeovsd2uk442dsc.jpg,https://www.tripadvisor.com.au/Attraction_Review-g60763-d23471923-Reviews-Intrepid_Urban_Adventures_New_York_City-New_York_City_New_York.html,4.9,"1,424 reviews",https://www.tripadvisor.com.au/Attraction_Review-g60763-d23471923-Reviews-Intrepid_Urban_Adventures_New_York_City-New_York_City_New_York.html#REVIEWS,"Intrepid has been taking travellers around the globe since 1989. With locally based leaders out front of every adventure, they have more than 1000 immersive trips in over 100 countries to choose from. More than just good views and great times, these adventures connect you to the places you go, the people you meet along the way and the communities at the heart of every Intrepid experience."
C7CD5E5F-B78C-464E-A147-E3ECA5F25D7B,San JosÈ,https://www.urbanadventures.com/en/san-jose,/san-jose,City,Costa Rica,North America,"With a tagline like ëPura Vidaí, you canít really go wrong with Costa Rica. Get into the swing of pure life on a San Jose tour with Urban Adventures to discover life as the locals know it in the Costa Rican capital. Journey through rainforests, cycle through suburbs, and sample some of Costa Ricaís finest exports ñ coffee and chocolate.",,https://cdn.ventrata.com/image/upload/s--CXZ33crf--/v1744724990/azluncjpgfqx9hon7g8s.jpg,https://www.tripadvisor.com.au/Attraction_Review-g309293-d23277987-Reviews-Intrepid_Urban_Adventures_San_Jose-San_Jose_San_Jose_Metro_Province_of_San_Jose.html,4.7,295 reviews,https://www.tripadvisor.com.au/Attraction_Review-g309293-d23277987-Reviews-Intrepid_Urban_Adventures_San_Jose-San_Jose_San_Jose_Metro_Province_of_San_Jose.html#REVIEWS,"Intrepid has been taking travellers around the globe since 1989. With locally based leaders out front of every adventure, they have more than 1000 immersive trips in over 100 countries to choose from. More than just good views and great times, these adventures connect you to the places you go, the people you meet along the way and the communities at the heart of every Intrepid experience."
81F1E89F-1DF5-4C16-9F2B-54E19C45D2EE,Seattle,https://www.urbanadventures.com/en/seattle,/seattle,City,United States,North America,"Seattle is known for its coffee, music, and amazing views! Join our local guide and uncover Seattleís back streets and hidden gems; take in the fascinating sights from the bustling Pike Place Market to the iconic Space Needle and learn the city like never before by getting acquainted with the local food, culture, and traditions!",,https://cdn.ventrata.com/image/upload/s--3LsEHjg1--/v1744725100/wq4veqci1z8m1cghnvaj.jpg,https://www.tripadvisor.com.au/Attraction_Review-g60878-d25294001-Reviews-Intrepid_Urban_Adventures_Seattle-Seattle_Washington.html,5,344 reviews,https://www.tripadvisor.com.au/Attraction_Review-g60878-d25294001-Reviews-Intrepid_Urban_Adventures_Seattle-Seattle_Washington.html#REVIEWS,"Intrepid has been taking travellers around the globe since 1989. With locally based leaders out front of every adventure, they have more than 1000 immersive trips in over 100 countries to choose from. More than just good views and great times, these adventures connect you to the places you go, the people you meet along the way and the communities at the heart of every Intrepid experience."
9220DAA9-ED8D-4AFA-B19D-07DE8FC8BC7A,Toronto,https://www.urbanadventures.com/en/toronto,/toronto,City,Canada,North America,"You know a cityís cool when Vogue says it is. The city got a major boost when the fashion mag declared Torontoís Queen West ëhood to be one of the coolest neighbourhoods in the world. Ranked as one of the globeís most multicultural communities, this ìcity of neighbourhoodsî offers up every flavour of international flare you can think of. Explore this cultural diversity and a few of the local hot spots (as well as beer and bacon!) with a Toronto city tour.",,https://cdn.ventrata.com/image/upload/s--BOkXnvzN--/v1744730767/hqcpqwmvpiwfhrkxthdq.jpg,https://www.tripadvisor.com.au/Attraction_Review-g155019-d23587913-Reviews-Intrepid_Urban_Adventures_Toronto-Toronto_Ontario.html,4.9,171 reviews,https://www.tripadvisor.com.au/Attraction_Review-g155019-d23587913-Reviews-Intrepid_Urban_Adventures_Toronto-Toronto_Ontario.html#REVIEWS,"Intrepid has been taking travellers around the globe since 1989. With locally based leaders out front of every adventure, they have more than 1000 immersive trips in over 100 countries to choose from. More than just good views and great times, these adventures connect you to the places you go, the people you meet along the way and the communities at the heart of every Intrepid experience."
56CD1ED5-2730-45FF-B6D1-5600A03A7DA6,Washington D.C.,https://www.urbanadventures.com/en/washington-d-c,/washington-d-c,City,United States,North America,"See Washington DC on our unique electric vehicles that can get you around both the main sites and the hidden secrets that only locals know. Great stories, great history, and great local knowledge from our local expert are what set us apart from the other Washington DC tours. Don't waste your day walking miles between the sites - take an Urban Adventures tour and make the most of your time in DC!",,https://cdn.ventrata.com/image/upload/s--U4y30_Qm--/v1744792497/qaq6aibw5kphxbbfw5qk.jpg,https://www.tripadvisor.com.au/Attraction_Review-g28970-d23471900-Reviews-Intrepid_Urban_Adventures_Washington-Washington_DC_District_of_Columbia.html,4.8,"2,335 reviews",https://www.tripadvisor.com.au/Attraction_Review-g28970-d23471900-Reviews-Intrepid_Urban_Adventures_Washington-Washington_DC_District_of_Columbia.html#REVIEWS,"Intrepid has been taking travellers around the globe since 1989. With locally based leaders out front of every adventure, they have more than 1000 immersive trips in over 100 countries to choose from. More than just good views and great times, these adventures connect you to the places you go, the people you meet along the way and the communities at the heart of every Intrepid experience."
B8E51689-E4AD-4AD1-B268-40B813DBBF7E,Cairo,https://www.urbanadventures.com/en/cairo,/cairo,City,Egypt,Africa,"Discover the worldís living history book by travelling to Cairo and exploring this mesmerising city with a local. The infamous sights are undeniable beautiful, but if you want to be packed with plenty of ëdid you knowsí about Cairo, seeing it with a local is a must. Donít let your Cairo travel experience read like something out of a guidebook ñ travel with a local to go behind the scenes in this incredible city.",,https://cdn.ventrata.com/image/upload/s--lWwL3L5h--/v1744802912/ykbbtrxlsp0cencxifgw.jpg,https://www.tripadvisor.com.au/Attraction_Review-g294201-d3176331-Reviews-Cairo_Urban_Adventures-Cairo_Cairo_Governorate.html,4.9,565 reviews,https://www.tripadvisor.com.au/Attraction_Review-g294201-d3176331-Reviews-Cairo_Urban_Adventures-Cairo_Cairo_Governorate.html#REVIEWS,"Cairo Urban Adventures offers day tours with a local around Cairo. They range from 2 hour to 12 hour adventures and uncover back streets, hidden gems, and fascinating sights. Step into the lives of locals, find out what makes the city tick, and get acquainted with the local food, culture, and traditions of Cairo. A local expert guide will provide the knowledge and lead you through a fantastic urban experience.‚Äù"
6AFDDAF7-899B-4FEA-A07F-CF1CBF5A5283,Casablanca,https://www.urbanadventures.com/en/casablanca,/casablanca,City,Morocco,Africa,"Ah, Casablanca. The city is famed for its art deco buildings, old medina and, of course, a very well-known movie. Itís admittedly a more modern city than you may expect from your black-and-white fantasies, but itís still a place youíll want to linger and where you can discover the modern side of Morocco. Spend your day wandering the city walls, browsing the old (and new) medina, exploring the beach, then chilling out with a mint tea in a cafÈ. Youíll quickly fall in love with Moroccan life and want to ëplay it againí the next day.",,https://cdn.ventrata.com/image/upload/s--sbWI5Ef5--/v1747298368/l52b6mkcowmdjfjxmpxd.jpg,https://www.tripadvisor.com.au/Attraction_Review-g293732-d14920309-Reviews-Casablanca_Urban_Adventures-Casablanca_Casablanca_Settat.html,4.8,253 reviews,https://www.tripadvisor.com.au/Attraction_Review-g293732-d14920309-Reviews-Casablanca_Urban_Adventures-Casablanca_Casablanca_Settat.html#REVIEWS,"Urban Adventures Morocco is the BEST.TEAM. EVER! We are made up of an exceptionally talented and knowledgeable group of Moroccans (Red, Abdu and Ayoub) with an extensive amount of experience in the travel industry and a genuine passion and pride for our country. Our goal is always to take you on an urban adventure that you will never forget!"
BB3B9EBD-E6CA-4E73-9CF4-A2BF86EF3511,Marrakech,https://www.urbanadventures.com/en/marrakech,/marrakech,City,Morocco,Africa,"Travel to Marrakech enriches all the senses ñ from the hoots and whistles of the bustling streets, the beautiful architecture, and the tantalising smells coming from all that delicious food. Marrakech is a destination so close to Europe, yet so foreign and different. Journey through the pink city with a local, and step back in time on our Marrakech tours that explore life in the medina as it has been for hundreds of years.",,https://cdn.ventrata.com/image/upload/s--NmURuI-V--/v1744818839/ltfmiy6kgf5iqorxekig.jpg,https://www.tripadvisor.com.au/Attraction_Review-g293734-d1856778-Reviews-Intrepid_Urban_Adventures_Marrakech-Marrakech_Marrakech_Safi.html,4.8,842 reviews,https://www.tripadvisor.com.au/Attraction_Review-g293734-d1856778-Reviews-Intrepid_Urban_Adventures_Marrakech-Marrakech_Marrakech_Safi.html#REVIEWS,"Marrakech Urban Adventures offers unique and authentic day tours around Marrakech. They range from 2 hour to 1 day adventures and uncover back streets, hidden gems, and fascinating sights. Step into the lives of locals, find out what makes the city tick, and get acquainted with the local food, culture, and traditions of Marrakech. A local expert guide will provide the knowledge and lead you through a fantastic urban experience."
851B6F85-64BA-4BF4-A913-37AD7320C272,Nairobi,https://www.urbanadventures.com/en/nairobi,/nairobi,City,Kenya,Africa,"Exciting and noticeably cosmopolitan, Nairobi is the social hub of East Africa, and Nairobi Urban Adventures provides your VIP ticket into the heart of it. Our one of a kind Nairobi tours offer the ideal way of getting out and experiencing the sights, smells, and sounds of this vibrant city and its surroundings, uncovering the real character and people of the ever-fascinating Nairobi.",,https://cdn.ventrata.com/image/upload/s--xsL59ExS--/v1744819438/p8mtvbtewm0fqxuyvjcd.jpg,https://www.tripadvisor.com.au/Attraction_Review-g294207-d1850071-Reviews-Nairobi_Urban_Adventures-Nairobi.html,4.8,263 reviews,https://www.tripadvisor.com.au/Attraction_Review-g294207-d1850071-Reviews-Nairobi_Urban_Adventures-Nairobi.html#REVIEWS,"Nairobi Urban Adventures offers unique and authentic day tours around Nairobi. They range from 2 hour to 1 day adventures and uncover back streets, hidden gems, and fascinating sights. Step into the lives of locals, find out what makes the city tick, and get acquainted with the local food, culture, and traditions of Nairobi. A local expert guide will provide the knowledge and lead you through a fantastic urban experience."
6E18BF1F-3811-42F4-AA19-FD016B18D9BE,Cusco,https://www.urbanadventures.com/en/cusco,/cusco,City,Peru,South America,"Cusco is a city full of hidden secrets and mystical tales. Dodge the standard things to do in Cusco and uncover some of these untold stories with a local guide, journeying through this incredible part of Peru to explore the lands of Inca legends. Alternatively, cool down your Cusco travel experience and simply learn how to make a crackiní Pisco Sour!",,https://cdn.ventrata.com/image/upload/s--9SE5vTV9--/v1744814990/w6ot1nkauabudtqyvy7h.jpg,https://www.tripadvisor.com.au/Attraction_Review-g294314-d1891924-Reviews-Cusco_Urban_Adventures-Cusco_Cusco_Region.html,4.6,52 reviews,https://www.tripadvisor.com.au/Attraction_Review-g294314-d1891924-Reviews-Cusco_Urban_Adventures-Cusco_Cusco_Region.html#REVIEWS,"Cusco Urban Adventures offers unique and authentic day tours around Cusco. They range from 2 hour to 1 day adventures and uncover back streets, hidden gems, and fascinating sights. Step into the lives of locals, find out what makes the city tick, and get acquainted with the local food, culture, and traditions of Cusco. A local expert guide will provide the knowledge and lead you through a fantastic urban experience."
4339E411-79CA-42B2-95C9-326483B589D3,Lima,https://www.urbanadventures.com/en/lima,/lima,City,Peru,South America,"With an unbeatable blend of ancient and modern, Peru is a country where youíre never too far away from a mystical Inca site, exceptional cuisine, the next big it-kid to make it on the worldís art scene, or simply the best Pisco Sour youíve ever tasted. Lima is no exception! Jump on one of our Lima tours to see this incredible city with a local.",,https://cdn.ventrata.com/image/upload/s--zjpCaNWq--/v1744817998/ypzih6za6mar1qgd4dcx.jpg,https://www.tripadvisor.com.au/Attraction_Review-g294316-d1891923-Reviews-Lima_Urban_Adventures-Lima_Lima_Region.html,4.9,274 reviews,https://www.tripadvisor.com.au/Attraction_Review-g294316-d1891923-Reviews-Lima_Urban_Adventures-Lima_Lima_Region.html#REVIEWS,"Lima Urban Adventures offers unique and authentic day tours around Lima. They range from 2 hour to 1 day adventures and uncover back streets, hidden gems, and fascinating sights. Step into the lives of locals, find out what makes the city tick, and get acquainted with the local food, culture, and traditions of Lima. A local expert guide will provide the knowledge and lead you through a fantastic urban experience."
533CF7B2-16DC-4DFB-9289-0114D5283922,Quito,https://www.urbanadventures.com/en/quito,/quito,City,Ecuador,South America,"With a delectable food scene, incredible mountain views, and an Old Town to die for, Quito has it all and more. Join a Quito local to get under the cityís skin by walking the streets, savouring the cuisine, discovering the markets, or taking a jaunt up into the mountains on a Quito tour you wonít be forgetting in a hurry.",,https://cdn.ventrata.com/image/upload/s--6gHKsBm3--/v1744821837/ugmbmvaomrj9qfnsanne.jpg,https://www.tripadvisor.com.au/Attraction_Review-g294308-d23379405-Reviews-Intrepid_Urban_Adventures_Quito-Quito_Pichincha_Province.html,4.7,39 reviews,https://www.tripadvisor.com.au/Attraction_Review-g294308-d23379405-Reviews-Intrepid_Urban_Adventures_Quito-Quito_Pichincha_Province.html#REVIEWS,"Intrepid has been taking travellers around the globe since 1989. With locally based leaders out front of every adventure, they have more than 1000 immersive trips in over 100 countries to choose from. More than just good views and great times, these adventures connect you to the places you go, the people you meet along the way and the communities at the heart of every Intrepid experience."
abc1,Australia,https://www.urbanadventures.com/australia,/australia,Country,,Oceania ,"From the cosmopolitan laneways of Melbourne to the pristine wilderness of Kangaroo Island, Australia offers an incredible blend of urban sophistication and untamed natural beauty. Experience world-class coffee culture alongside friendly locals, discover unique wildlife in their natural habitats, and explore stunning coastlines that stretch endlessly under the Southern Cross. This diverse continent captivates visitors with its laid-back lifestyle, multicultural cuisine, and landscapes that range from tropical rainforests to red desert heart, all wrapped up in the warmth of genuine Aussie hospitality.",,,,,,,
abc2,Greece,https://www.urbanadventures.com/greece,/greece,Country,,Europe,"Step into the cradle of Western civilization where ancient history comes alive on every street corner and island breeze. Greece enchants travelers with its whitewashed villages perched on azure coastlines, bustling markets filled with Mediterranean flavors, and archaeological wonders that have inspired humanity for millennia. From savoring authentic Greek cuisine in hidden tavernas to exploring mythical sites with passionate local guides, this timeless destination offers the perfect blend of relaxation and cultural discovery that will leave you saying ""yamas!"" to life.",,,,,,,
